flair_block,reported_topic_rank,topic_id,label,title,permalink
Frage/Advice - EN,1,3,could / next,What to do with a lost cat?,https://reddit.com/r/stuttgart/comments/1j87768/what_to_do_with_a_lost_cat/
Frage/Advice - EN,1,3,could / next,I’m looking for this location,https://reddit.com/r/stuttgart/comments/1h1rss3/im_looking_for_this_location/
Frage/Advice - EN,1,3,could / next,What the hell just exploded?,https://reddit.com/r/stuttgart/comments/1kp5fem/what_the_hell_just_exploded/
Frage/Advice - EN,2,0,free / say,New Kid in Stuttgart,https://reddit.com/r/stuttgart/comments/1lb2xc3/new_kid_in_stuttgart/
Frage/Advice - EN,2,0,free / say,What is this red thing on the train?,https://reddit.com/r/stuttgart/comments/1mcgkfv/what_is_this_red_thing_on_the_train/
Frage/Advice - EN,2,0,free / say,Will Wagenburg tunnel ever be open for pedestrians?,https://reddit.com/r/stuttgart/comments/1nrzzx5/will_wagenburg_tunnel_ever_be_open_for_pedestrians/
Frage/Advice - EN,3,4,cold / name,Did you guys hear about the Swabian fridge?,https://reddit.com/r/stuttgart/comments/1j0whbj/did_you_guys_hear_about_the_swabian_fridge/
Frage/Advice - EN,3,4,cold / name,Found while rearranging my basement in Stuttgart Germany ,https://reddit.com/r/stuttgart/comments/1g2lti2/found_while_rearranging_my_basement_in_stuttgart/
Frage/Advice - EN,4,1,good enough,What would it cost to fix this?,https://reddit.com/r/stuttgart/comments/1m7wlsf/what_would_it_cost_to_fix_this/
