reported_topic_rank,topic_id,title,permalink
1,1,Warum sind Menschen so und wie reagiert ihr am Besten darauf?,https://reddit.com/r/stuttgart/comments/1h2xuqd/warum_sind_menschen_so_und_wie_reagiert_ihr_am/
1,1, allein in Club gehen?,https://reddit.com/r/stuttgart/comments/1hcfllw/allein_in_club_gehen/
1,1,Die Ausländerbehörde Stuttgart hat mein Leben komplett zerstört,https://reddit.com/r/stuttgart/comments/1ns6ydw/die_ausländerbehörde_stuttgart_hat_mein_leben/
2,5,Stuttgart Open Data - Sozialmietwohnungen,https://reddit.com/r/stuttgart/comments/1iqs1l2/stuttgart_open_data_sozialmietwohnungen/
2,5,Darf man hier wirklich kostenlos parken?,https://reddit.com/r/stuttgart/comments/1nhqyix/darf_man_hier_wirklich_kostenlos_parken/
2,5,Erinnerung an die guten Clubs und Bars der Stadt,https://reddit.com/r/stuttgart/comments/1nuoah0/erinnerung_an_die_guten_clubs_und_bars_der_stadt/
3,0,S1-Horror,https://reddit.com/r/stuttgart/comments/1jdhrn8/s1horror/
3,0,Das neue S-Bahn Konzept ab 2032,https://reddit.com/r/stuttgart/comments/1imgogn/das_neue_sbahn_konzept_ab_2032/
3,0,Wann Demo für zuverlässige Sbahn?,https://reddit.com/r/stuttgart/comments/1np53jb/wann_demo_für_zuverlässige_sbahn/
4,6,44.000 Menschen auf dem Schlossplatz sind die Stuttgarter Brandmauer,https://reddit.com/r/stuttgart/comments/1ifqjs1/44000_menschen_auf_dem_schlossplatz_sind_die/
4,6,Wahl-O-Mat Bundestagswahl 2025,https://reddit.com/r/stuttgart/comments/1ij6l5r/wahlomat_bundestagswahl_2025/
4,6,"Was ist die Funktion dieser ""Schornsteine""? ",https://reddit.com/r/stuttgart/comments/1i2o4jz/was_ist_die_funktion_dieser_schornsteine/
5,2,Welche Wirkung hat dieses Haus aus Stuttgart auf euch?,https://reddit.com/r/stuttgart/comments/1iwl0tt/welche_wirkung_hat_dieses_haus_aus_stuttgart_auf/
5,2,Stuttgart on a Disk,https://reddit.com/r/stuttgart/comments/1g4tpnb/stuttgart_on_a_disk/
5,2,Kanzleistraße am kleinen Schlossplatz um 1942 und heute.,https://reddit.com/r/stuttgart/comments/1nifac3/kanzleistraße_am_kleinen_schlossplatz_um_1942_und/
