flair_block,reported_topic_rank,topic_id,label,title,permalink
News,1,2,bahn,Sie ist nun da 🙄,https://reddit.com/r/stuttgart/comments/1ns5fl4/sie_ist_nun_da/
News,1,2,bahn,Unfall Bahn Ausfall HBF Bopser,https://reddit.com/r/stuttgart/comments/1hh4t4p/unfall_bahn_ausfall_hbf_bopser/
News,1,2,bahn,Kormorane im Schlossgarten,https://reddit.com/r/stuttgart/comments/1is8tdu/kormorane_im_schlossgarten/
News,2,1,ruft polizei,Zivilcourage rettet Leben.,https://reddit.com/r/stuttgart/comments/1jmj8hc/zivilcourage_rettet_leben/
News,2,1,ruft polizei,ACHTUNG scammer Masche Wilhelmsplatz Stgt,https://reddit.com/r/stuttgart/comments/1gss8ct/achtung_scammer_masche_wilhelmsplatz_stgt/
News,2,1,ruft polizei,Carbrain wütet in S-Ost,https://reddit.com/r/stuttgart/comments/1lgtrs0/carbrain_wütet_in_sost/
News,3,3,platz tage,Vermüllung Sammelplätze,https://reddit.com/r/stuttgart/comments/1lzsior/vermüllung_sammelplätze/
News,3,3,platz tage,Heftige Explosion in Nord?!,https://reddit.com/r/stuttgart/comments/1j0kym8/heftige_explosion_in_nord/
News,3,3,platz tage,Großaufgebot Kontrolletis,https://reddit.com/r/stuttgart/comments/1jukkti/großaufgebot_kontrolletis/
News,4,0,polizei,Polizeieinsatz in Stuttgart-Ost: Zeuge filmte tödlichen Schuss – das ist auf dem Video zu erkennen,https://reddit.com/r/stuttgart/comments/1lrdxtc/polizeieinsatz_in_stuttgartost_zeuge_filmte/
News,4,0,polizei,Nachtragsmeldung zum tödlich verletzten Kind an der Stadtbahnhaltestelle Max-Eyth-See: Keine Absicht,https://reddit.com/r/stuttgart/comments/1iihw45/nachtragsmeldung_zum_tödlich_verletzten_kind_an/
