flair_block,reported_topic_rank,topic_id,label,title,permalink
Frage/Advice,1,2,findet / immer,Was soll denn heute falsch sein mit der Luftqualität?,https://reddit.com/r/stuttgart/comments/1im3kg1/was_soll_denn_heute_falsch_sein_mit_der/
Frage/Advice,1,2,findet / immer,Darf man hier wirklich kostenlos parken?,https://reddit.com/r/stuttgart/comments/1nhqyix/darf_man_hier_wirklich_kostenlos_parken/
Frage/Advice,1,2,findet / immer,Was ist da los ?,https://reddit.com/r/stuttgart/comments/1lpp0zc/was_ist_da_los/
Frage/Advice,2,3,informationen / ahnung,Found while rearranging my basement in Stuttgart Germany ,https://reddit.com/r/stuttgart/comments/1g2lti2/found_while_rearranging_my_basement_in_stuttgart/
Frage/Advice,2,3,informationen / ahnung,Stuttgart Steinwinter Junior 50,https://reddit.com/r/stuttgart/comments/1hh9quu/stuttgart_steinwinter_junior_50/
Frage/Advice,2,3,informationen / ahnung,Was für eine Performance ist das?,https://reddit.com/r/stuttgart/comments/1ng4jlh/was_für_eine_performance_ist_das/
Frage/Advice,3,7,wohl / gut,Suche Bar in der ich neulich war,https://reddit.com/r/stuttgart/comments/1k7gwoo/suche_bar_in_der_ich_neulich_war/
Frage/Advice,3,7,wohl / gut,Was wird während der Stammstreckensperrung eigentlich gemacht?,https://reddit.com/r/stuttgart/comments/1nbqkva/was_wird_während_der_stammstreckensperrung/
Frage/Advice,3,7,wohl / gut,Mehrere Laute Explosionen und dicker Schwarzer Rauch,https://reddit.com/r/stuttgart/comments/1lhfmbe/mehrere_laute_explosionen_und_dicker_schwarzer/
Frage/Advice,4,4,bahn,S-Bahn Linie S62 ... ein Mythos?,https://reddit.com/r/stuttgart/comments/1l24qqg/sbahn_linie_s62_ein_mythos/
Frage/Advice,4,4,bahn,Was bedeuten die Kästchen bei der S-Bahn ,https://reddit.com/r/stuttgart/comments/1huknt6/was_bedeuten_die_kästchen_bei_der_sbahn/
Frage/Advice,4,4,bahn,Was ging beim Milaneo ab?,https://reddit.com/r/stuttgart/comments/1map2zj/was_ging_beim_milaneo_ab/
Frage/Advice,5,8,fernsehturm,Wessen Schädel haben wir hier gefunden?,https://reddit.com/r/stuttgart/comments/1njcewb/wessen_schädel_haben_wir_hier_gefunden/
Frage/Advice,5,8,fernsehturm,Was ist das seltsame Objekt von 1592?,https://reddit.com/r/stuttgart/comments/1nsjjeo/was_ist_das_seltsame_objekt_von_1592/
Frage/Advice,5,8,fernsehturm,Where in Stuttgart can I do this?,https://reddit.com/r/stuttgart/comments/1izpzy8/where_in_stuttgart_can_i_do_this/
