flair_block,reported_topic_rank,topic_id,label,title,permalink
Diskussion - EN,1,1,German - Places,Male experience in Stuttgart,https://reddit.com/r/stuttgart/comments/1kp2zcy/male_experience_in_stuttgart/
Diskussion - EN,1,1,German - Places,Is it ok to be a bus driver's hostage?,https://reddit.com/r/stuttgart/comments/1iiwnk0/is_it_ok_to_be_a_bus_drivers_hostage/
Diskussion - EN,1,1,German - Places,People are deliberately destroying EV charging stations- why,https://reddit.com/r/stuttgart/comments/1mpvibq/people_are_deliberately_destroying_ev_charging/
Diskussion - EN,2,0,Instead - Top,Districts of Stuttgart,https://reddit.com/r/stuttgart/comments/1idhxzu/districts_of_stuttgart/
Diskussion - EN,2,0,Instead - Top,The mayor of Stuttgart,https://reddit.com/r/stuttgart/comments/1gawl1h/the_mayor_of_stuttgart/
Diskussion - EN,2,0,Instead - Top,Are there any plans to include the Necker in Stuttgart?,https://reddit.com/r/stuttgart/comments/1g4wsx1/are_there_any_plans_to_include_the_necker_in/
