flair_block,reported_topic_rank,topic_id,label,title,permalink
Diskussion - DE,1,6,fahren - voll,"Ist es nur ein Stuttgarter Ding ""verschickt"" zu verrückt zu sagen? Habe gemerkt dass ich in anderen Städten wen Ich das gesagt habe nie verstanden wurde.",https://reddit.com/r/stuttgart/comments/1n93go0/ist_es_nur_ein_stuttgarter_ding_verschickt_zu/
Diskussion - DE,1,6,fahren - voll,Gekaufte Restaurantbewertungen in Stuttgart,https://reddit.com/r/stuttgart/comments/1iigmta/gekaufte_restaurantbewertungen_in_stuttgart/
Diskussion - DE,1,6,fahren - voll,Leute: Verkaufsautomat,https://reddit.com/r/stuttgart/comments/1n90gbm/leute_verkaufsautomat/
Diskussion - DE,2,7,arbeit - halten,U-Bahn - Mittelgang ist Lava,https://reddit.com/r/stuttgart/comments/1n6owmk/ubahn_mittelgang_ist_lava/
Diskussion - DE,2,7,arbeit - halten,Zum Glück sind Polizeiautos nicht brennbar,https://reddit.com/r/stuttgart/comments/1nq5yfg/zum_glück_sind_polizeiautos_nicht_brennbar/
Diskussion - DE,2,7,arbeit - halten,Mehr Grafiti,https://reddit.com/r/stuttgart/comments/1jdg6j1/mehr_grafiti/
Diskussion - DE,3,5,oft - geld,Welche Wirkung hat dieses Haus aus Stuttgart auf euch?,https://reddit.com/r/stuttgart/comments/1iwl0tt/welche_wirkung_hat_dieses_haus_aus_stuttgart_auf/
Diskussion - DE,3,5,oft - geld,Hat die Stadtverwaltung in der Straße aufgegeben?,https://reddit.com/r/stuttgart/comments/1me6zab/hat_die_stadtverwaltung_in_der_straße_aufgegeben/
Diskussion - DE,3,5,oft - geld,Feindliche Architektur in Stuttgart,https://reddit.com/r/stuttgart/comments/1h474xw/feindliche_architektur_in_stuttgart/
Diskussion - DE,4,2,interesse - gefunden,Leben in einer Dachgeschosswohnung in Stuttgart: Mein Rücken schwitzt nicht mehr!,https://reddit.com/r/stuttgart/comments/1logaug/leben_in_einer_dachgeschosswohnung_in_stuttgart/
Diskussion - DE,4,2,interesse - gefunden,Stuttgart Open Data - Sozialmietwohnungen,https://reddit.com/r/stuttgart/comments/1iqs1l2/stuttgart_open_data_sozialmietwohnungen/
Diskussion - DE,4,2,interesse - gefunden,Skandal im Landtag in Stuttgart: Hakenkreuz auf Stimmzettel geschmiert. Toll was wir da in unserer Landesvertretung sitzen haben..,https://reddit.com/r/stuttgart/comments/1m8fh2l/skandal_im_landtag_in_stuttgart_hakenkreuz_auf/
Diskussion - DE,5,4,zeit - innenstadt,Auf welche Restaurants in Stuttgart trifft das zu?,https://reddit.com/r/stuttgart/comments/1mmnkcb/auf_welche_restaurants_in_stuttgart_trifft_das_zu/
Diskussion - DE,5,4,zeit - innenstadt,"Verlorene Gebäude in Stuttgart, Altes Rathaus, Villa Berg & Moser, Lusthaus etc. Was haltet ihr vom Neubau? Für alle die sich für alte Gebäude interessieren",https://reddit.com/r/stuttgart/comments/1jio933/verlorene_gebäude_in_stuttgart_altes_rathaus/
