flair_block,reported_topic_rank,topic_id,label,title,permalink
News,1,3,mal / letzte,Polizeieinsatz in Stuttgart-Ost: Zeuge filmte tödlichen Schuss – das ist auf dem Video zu erkennen,https://reddit.com/r/stuttgart/comments/1lrdxtc/polizeieinsatz_in_stuttgartost_zeuge_filmte/
News,1,3,mal / letzte,Nachtragsmeldung zum tödlich verletzten Kind an der Stadtbahnhaltestelle Max-Eyth-See: Keine Absicht,https://reddit.com/r/stuttgart/comments/1iihw45/nachtragsmeldung_zum_tödlich_verletzten_kind_an/
News,1,3,mal / letzte,Vermüllung Sammelplätze,https://reddit.com/r/stuttgart/comments/1lzsior/vermüllung_sammelplätze/
News,2,1,zufußgehende carbrain,Carbrain wütet in S-Ost,https://reddit.com/r/stuttgart/comments/1lgtrs0/carbrain_wütet_in_sost/
News,2,1,zufußgehende carbrain,Warum muss das trojanische Pferd am Stöckach sterben?,https://reddit.com/r/stuttgart/comments/1gk2biy/warum_muss_das_trojanische_pferd_am_stöckach/
News,2,1,zufußgehende carbrain,18-jährige zieht Notbremse in der S-Bahn,https://reddit.com/r/stuttgart/comments/1gbt0mz/18jährige_zieht_notbremse_in_der_sbahn/
News,3,2,olgaeck / hbf,Sie ist nun da 🙄,https://reddit.com/r/stuttgart/comments/1ns5fl4/sie_ist_nun_da/
News,3,2,olgaeck / hbf,Unfall Bahn Ausfall HBF Bopser,https://reddit.com/r/stuttgart/comments/1hh4t4p/unfall_bahn_ausfall_hbf_bopser/
News,3,2,olgaeck / hbf,Heftige Explosion in Nord?!,https://reddit.com/r/stuttgart/comments/1j0kym8/heftige_explosion_in_nord/
News,4,0,polizei / auto,Zivilcourage rettet Leben.,https://reddit.com/r/stuttgart/comments/1jmj8hc/zivilcourage_rettet_leben/
News,4,0,polizei / auto,ACHTUNG scammer Masche Wilhelmsplatz Stgt,https://reddit.com/r/stuttgart/comments/1gss8ct/achtung_scammer_masche_wilhelmsplatz_stgt/
News,4,0,polizei / auto,Großaufgebot Kontrolletis,https://reddit.com/r/stuttgart/comments/1jukkti/großaufgebot_kontrolletis/
